{"schema_version":"1.0.0","dataset":"skill-trends","generated_at":"2026-10-17T02:19:08.541764Z","run_id":"38994389031-1","data_window":{"start":"2026-10-16","end":"2026-10-17"},"coverage":{"sources":[{"source":"gupy","status_last_run":"ok","last_success_at":"2026-10-17T02:19:06.625287Z","records_last_run":243,"jobs_in_history":257}],"observations":200,"note":"Amostra das fontes e termos configurados no JobRadar; não representa o mercado inteiro. Tendências consideram o volume coletado por período."},"data":{"taxonomy":[{"id":"python","name":"Python","category":"linguagem"},{"id":"sql","name":"SQL","category":"linguagem"},{"id":"scala","name":"Scala","category":"linguagem"},{"id":"java","name":"Java","category":"linguagem"},{"id":"spark","name":"Apache Spark","category":"processamento"},{"id":"databricks","name":"Databricks","category":"plataforma"},{"id":"kafka","name":"Kafka / Streaming","category":"processamento"},{"id":"etl","name":"ETL / ELT","category":"processamento"},{"id":"airflow","name":"Apache Airflow","category":"orquestracao"},{"id":"dbt","name":"dbt","category":"transformacao"},{"id":"data_factory","name":"Azure Data Factory","category":"orquestracao"},{"id":"azure","name":"Azure","category":"cloud"},{"id":"aws","name":"AWS","category":"cloud"},{"id":"gcp","name":"Google Cloud","category":"cloud"},{"id":"data_warehouse","name":"Data Warehouse","category":"modelagem"},{"id":"data_lake","name":"Data Lake / Lakehouse","category":"modelagem"},{"id":"modelagem","name":"Modelagem de dados","category":"modelagem"},{"id":"snowflake","name":"Snowflake","category":"plataforma"},{"id":"nosql","name":"NoSQL","category":"armazenamento"},{"id":"oracle","name":"Oracle","category":"armazenamento"},{"id":"postgres","name":"PostgreSQL","category":"armazenamento"},{"id":"qualidade_dados","name":"Qualidade de dados","category":"governanca"},{"id":"governanca","name":"Governança de dados","category":"governanca"},{"id":"lgpd","name":"LGPD / Privacidade","category":"governanca"},{"id":"git","name":"Git","category":"devops"},{"id":"docker","name":"Docker","category":"devops"},{"id":"cicd","name":"CI/CD","category":"devops"},{"id":"terraform","name":"Terraform / IaC","category":"devops"},{"id":"apis","name":"APIs REST","category":"integracao"},{"id":"power_bi","name":"Power BI","category":"visualizacao"},{"id":"looker_tableau","name":"Looker / Tableau","category":"visualizacao"}],"scope":{"families":["engenharia_dados","analytics_engineering","desenvolvimento_dados","analise_dados","governanca_qualidade"],"cohort":"mes_da_primeira_observacao"},"min_sample":30,"current":{"window_days":90,"n":200,"low_sample":false,"skills":[{"skill_id":"sql","jobs":156,"required_jobs":79,"pct":78.0,"required_pct":39.5},{"skill_id":"python","jobs":140,"required_jobs":68,"pct":70.0,"required_pct":34.0},{"skill_id":"etl","jobs":120,"required_jobs":64,"pct":60.0,"required_pct":32.0},{"skill_id":"data_lake","jobs":99,"required_jobs":48,"pct":49.5,"required_pct":24.0},{"skill_id":"data_warehouse","jobs":91,"required_jobs":45,"pct":45.5,"required_pct":22.5},{"skill_id":"modelagem","jobs":88,"required_jobs":41,"pct":44.0,"required_pct":20.5},{"skill_id":"governanca","jobs":82,"required_jobs":42,"pct":41.0,"required_pct":21.0},{"skill_id":"power_bi","jobs":79,"required_jobs":43,"pct":39.5,"required_pct":21.5},{"skill_id":"databricks","jobs":78,"required_jobs":40,"pct":39.0,"required_pct":20.0},{"skill_id":"aws","jobs":75,"required_jobs":34,"pct":37.5,"required_pct":17.0},{"skill_id":"spark","jobs":71,"required_jobs":37,"pct":35.5,"required_pct":18.5},{"skill_id":"azure","jobs":69,"required_jobs":34,"pct":34.5,"required_pct":17.0},{"skill_id":"cicd","jobs":69,"required_jobs":33,"pct":34.5,"required_pct":16.5},{"skill_id":"gcp","jobs":65,"required_jobs":33,"pct":32.5,"required_pct":16.5},{"skill_id":"git","jobs":64,"required_jobs":29,"pct":32.0,"required_pct":14.5},{"skill_id":"apis","jobs":55,"required_jobs":30,"pct":27.5,"required_pct":15.0},{"skill_id":"qualidade_dados","jobs":55,"required_jobs":31,"pct":27.5,"required_pct":15.5},{"skill_id":"airflow","jobs":49,"required_jobs":24,"pct":24.5,"required_pct":12.0},{"skill_id":"kafka","jobs":38,"required_jobs":15,"pct":19.0,"required_pct":7.5},{"skill_id":"dbt","jobs":35,"required_jobs":19,"pct":17.5,"required_pct":9.5},{"skill_id":"terraform","jobs":32,"required_jobs":8,"pct":16.0,"required_pct":4.0},{"skill_id":"lgpd","jobs":29,"required_jobs":17,"pct":14.5,"required_pct":8.5},{"skill_id":"data_factory","jobs":25,"required_jobs":10,"pct":12.5,"required_pct":5.0},{"skill_id":"looker_tableau","jobs":24,"required_jobs":15,"pct":12.0,"required_pct":7.5},{"skill_id":"snowflake","jobs":24,"required_jobs":13,"pct":12.0,"required_pct":6.5},{"skill_id":"nosql","jobs":21,"required_jobs":7,"pct":10.5,"required_pct":3.5},{"skill_id":"oracle","jobs":17,"required_jobs":7,"pct":8.5,"required_pct":3.5},{"skill_id":"postgres","jobs":14,"required_jobs":5,"pct":7.0,"required_pct":2.5},{"skill_id":"docker","jobs":13,"required_jobs":2,"pct":6.5,"required_pct":1.0},{"skill_id":"scala","jobs":7,"required_jobs":4,"pct":3.5,"required_pct":2.0},{"skill_id":"java","jobs":6,"required_jobs":3,"pct":3.0,"required_pct":1.5}]},"monthly":[{"month":"2026-10","skill_id":"sql","jobs":156,"total_jobs":200,"pct":78.0,"low_sample":false},{"month":"2026-10","skill_id":"python","jobs":140,"total_jobs":200,"pct":70.0,"low_sample":false},{"month":"2026-10","skill_id":"etl","jobs":120,"total_jobs":200,"pct":60.0,"low_sample":false},{"month":"2026-10","skill_id":"data_lake","jobs":99,"total_jobs":200,"pct":49.5,"low_sample":false},{"month":"2026-10","skill_id":"data_warehouse","jobs":91,"total_jobs":200,"pct":45.5,"low_sample":false},{"month":"2026-10","skill_id":"modelagem","jobs":88,"total_jobs":200,"pct":44.0,"low_sample":false},{"month":"2026-10","skill_id":"governanca","jobs":82,"total_jobs":200,"pct":41.0,"low_sample":false},{"month":"2026-10","skill_id":"power_bi","jobs":79,"total_jobs":200,"pct":39.5,"low_sample":false},{"month":"2026-10","skill_id":"databricks","jobs":78,"total_jobs":200,"pct":39.0,"low_sample":false},{"month":"2026-10","skill_id":"aws","jobs":75,"total_jobs":200,"pct":37.5,"low_sample":false},{"month":"2026-10","skill_id":"spark","jobs":71,"total_jobs":200,"pct":35.5,"low_sample":false},{"month":"2026-10","skill_id":"azure","jobs":69,"total_jobs":200,"pct":34.5,"low_sample":false},{"month":"2026-10","skill_id":"cicd","jobs":69,"total_jobs":200,"pct":34.5,"low_sample":false},{"month":"2026-10","skill_id":"gcp","jobs":65,"total_jobs":200,"pct":32.5,"low_sample":false},{"month":"2026-10","skill_id":"git","jobs":64,"total_jobs":200,"pct":32.0,"low_sample":false},{"month":"2026-10","skill_id":"apis","jobs":55,"total_jobs":200,"pct":27.5,"low_sample":false},{"month":"2026-10","skill_id":"qualidade_dados","jobs":55,"total_jobs":200,"pct":27.5,"low_sample":false},{"month":"2026-10","skill_id":"airflow","jobs":49,"total_jobs":200,"pct":24.5,"low_sample":false},{"month":"2026-10","skill_id":"kafka","jobs":38,"total_jobs":200,"pct":19.0,"low_sample":false},{"month":"2026-10","skill_id":"dbt","jobs":35,"total_jobs":200,"pct":17.5,"low_sample":false},{"month":"2026-10","skill_id":"terraform","jobs":32,"total_jobs":200,"pct":16.0,"low_sample":false},{"month":"2026-10","skill_id":"lgpd","jobs":29,"total_jobs":200,"pct":14.5,"low_sample":false},{"month":"2026-10","skill_id":"data_factory","jobs":25,"total_jobs":200,"pct":12.5,"low_sample":false},{"month":"2026-10","skill_id":"looker_tableau","jobs":24,"total_jobs":200,"pct":12.0,"low_sample":false},{"month":"2026-10","skill_id":"snowflake","jobs":24,"total_jobs":200,"pct":12.0,"low_sample":false},{"month":"2026-10","skill_id":"nosql","jobs":21,"total_jobs":200,"pct":10.5,"low_sample":false},{"month":"2026-10","skill_id":"oracle","jobs":17,"total_jobs":200,"pct":8.5,"low_sample":false},{"month":"2026-10","skill_id":"postgres","jobs":14,"total_jobs":200,"pct":7.0,"low_sample":false},{"month":"2026-10","skill_id":"docker","jobs":13,"total_jobs":200,"pct":6.5,"low_sample":false},{"month":"2026-10","skill_id":"scala","jobs":7,"total_jobs":200,"pct":3.5,"low_sample":false},{"month":"2026-10","skill_id":"java","jobs":6,"total_jobs":200,"pct":3.0,"low_sample":false}],"by_seniority":[{"seniority":"estagio","skill_id":"airflow","jobs":1,"total_jobs":8,"pct":12.5,"low_sample":true},{"seniority":"estagio","skill_id":"apis","jobs":2,"total_jobs":8,"pct":25.0,"low_sample":true},{"seniority":"estagio","skill_id":"aws","jobs":2,"total_jobs":8,"pct":25.0,"low_sample":true},{"seniority":"estagio","skill_id":"azure","jobs":2,"total_jobs":8,"pct":25.0,"low_sample":true},{"seniority":"estagio","skill_id":"data_lake","jobs":4,"total_jobs":8,"pct":50.0,"low_sample":true},{"seniority":"estagio","skill_id":"data_warehouse","jobs":4,"total_jobs":8,"pct":50.0,"low_sample":true},{"seniority":"estagio","skill_id":"etl","jobs":7,"total_jobs":8,"pct":87.5,"low_sample":true},{"seniority":"estagio","skill_id":"gcp","jobs":1,"total_jobs":8,"pct":12.5,"low_sample":true},{"seniority":"estagio","skill_id":"git","jobs":3,"total_jobs":8,"pct":37.5,"low_sample":true},{"seniority":"estagio","skill_id":"governanca","jobs":3,"total_jobs":8,"pct":37.5,"low_sample":true},{"seniority":"estagio","skill_id":"modelagem","jobs":4,"total_jobs":8,"pct":50.0,"low_sample":true},{"seniority":"estagio","skill_id":"power_bi","jobs":1,"total_jobs":8,"pct":12.5,"low_sample":true},{"seniority":"estagio","skill_id":"python","jobs":8,"total_jobs":8,"pct":100.0,"low_sample":true},{"seniority":"estagio","skill_id":"sql","jobs":7,"total_jobs":8,"pct":87.5,"low_sample":true},{"seniority":"junior","skill_id":"airflow","jobs":3,"total_jobs":17,"pct":17.6,"low_sample":true},{"seniority":"junior","skill_id":"aws","jobs":5,"total_jobs":17,"pct":29.4,"low_sample":true},{"seniority":"junior","skill_id":"azure","jobs":2,"total_jobs":17,"pct":11.8,"low_sample":true},{"seniority":"junior","skill_id":"cicd","jobs":4,"total_jobs":17,"pct":23.5,"low_sample"